Company Name,Ticker,Fiscal Year,Revenue Group (Reportable Segment),Revenue Line,Line Item description (company language),Revenue ($m)
AMAZON COM INC,AMZN,2024,Product/Service disclosure,Online stores,Represents the change in reported amounts resulting from changes in foreign exchange rates from those in effect in the comparable prior year period for operating results.,247029.0
AMAZON COM INC,AMZN,2024,Product/Service disclosure,Third-party seller services,"We offer programs that enable sellers to grow their businesses, sell their products in our stores, and fulfill orders using our services, earning fixed fees, a percentage of sales, per-unit activity fees, interest, or some combination thereof, for our seller programs.",156146.0
AMAZON COM INC,AMZN,2024,Product/Service disclosure,AWS,"AWS offers a broad set of on-demand technology services, including compute, storage, database, analytics, and machine learning, and other services to developers and enterprises of all sizes.",107556.0
AMAZON COM INC,AMZN,2024,Product/Service disclosure,Advertising services,"Advertising services (4) includes sales of advertising services to sellers, vendors, publishers, authors, and others, through programs such as sponsored ads, display, and video advertising.",56214.0
AMAZON COM INC,AMZN,2024,Product/Service disclosure,Subscription services,"Subscription services (5) includes annual and monthly fees associated with Amazon Prime memberships, as well as digital video, audiobook, digital music, e-book, and other non-AWS subscription services.",44374.0
AMAZON COM INC,AMZN,2024,Product/Service disclosure,Physical stores,"Physical stores (2) includes sales from our physical store locations, which as of December 31, 2024, included 618 North America and 27 International stores.",21215.0
AMAZON COM INC,AMZN,2024,Product/Service disclosure,Other,,5425.0
